id	Category	Term	Count	%	PValue	Genes	List Total	Pop Hits	Pop Total	Fold Enrichment	Bonferroni	Benjamini	FDR
line61	GOTERM_BP_FAT	GO:0044092~negative regulation of molecular function	66	7.18171926	0.015832813	CAST, TNFSF14, ZNF675, LRRC15, CDKN2A, SPINT2, CDK5RAP3, PSMD5, NR2F2, MT3, SP100, APCS, VIL1, PRKCD, PKIA, MTRR, WFDC13, CRHR1, EIF4A3, ARRB2, CPAMD8, PSME2, GRM7, PSMA3, BUB1B, ZNF431, CAND1, SERPINB4, MAPRE1, WFDC2, CAV3, CAV1, PKHD1, PSMA7, TRIB1, UGT1A9, ANKRD33, PSMB6, OAZ1, HAND1, LRRTM3, HRG, RTN4RL2, THBS1, USP33, CRIM1, TERF1, TMC8, PCIF1, GRXCR1, FETUB, TAF7, BIRC7, TNNI3, TAX1BP1, PRPSAP2, CORO1C, SFRP1, CD300A, LTB4R2, USP47, FAF2, PTPN1, DUSP8, DNAJB6, ADAR	754	1100	16650	1.324933687	1	0.860948696	26.6917521
line62	GOTERM_BP_FAT	GO:0009309~amine biosynthetic process	5	0.544069641	0.01583975	OAZ1, HDC, DBH, SMS, TPH2	754	22	16650	5.018688208	1	0.855587575	26.70180417
line63	GOTERM_BP_FAT	GO:2000058~regulation of protein ubiquitination involved in ubiquitin-dependent protein catabolic process	11	1.19695321	0.01595365	CAV3, WNT1, PDCL3, CDKN2A, PSMB6, PSME2, PSMA3, BUB1B, CDK5RAP3, PSMD5, PSMA7	754	101	16650	2.404995141	1	0.852160241	26.86666743
line64	GOTERM_BP_FAT	GO:0065009~regulation of molecular function	153	16.64853101	0.01607177	CAST, ATP1B2, WNT3A, TNFSF14, RGL4, VIPR2, RGL2, BTK, WNT1, CDKN2A, DIRAS3, CTGF, ASPH, MADD, RELA, LYPLA1, NTSR1, PKIA, HNRNPU, WFDC13, CRHR1, ARRB2, PSMA3, ZNF431, VAMP2, WFDC2, FGD2, CAV3, FXYD2, MFNG, ARFGAP3, CAV1, FGR, PKHD1, PFKFB1, MST1, TRPT1, PSMA7, CCL4, LIF, RASAL1, OAZ1, PSMB6, DIABLO, PCIF1, KLB, GRXCR1, TAF7, TNNI3, TAX1BP1, PRPSAP2, HDAC5, CORO1C, SFRP1, TSC1, P2RX1, CD300A, EPHA8, LTB4R2, AVPR1A, PTPN1, SYNGAP1, PDCD6, PPP2R3C, DNAJB6, ADAR, JPH3, NRP1, TSG101, ZNF675, TERF2IP, LRRC15, KCNIP2, KCNJ11, PDCD2, ACVR1C, HSF1, SPINT2, NMUR2, PCP2, CDK5RAP3, NOS2, PSMD5, NR2F2, AHNAK, ANGPT4, MT3, ARL1, APCS, SP100, RALBP1, ARID5B, VIL1, MMP16, UBE2I, CACNG3, NRXN1, GRM1, CDK5, PRKCD, MTRR, EIF4A3, PSME2, CPAMD8, GRM7, TXN, WNT9B, SRGAP3, RIN2, BUB1B, PLA2G6, CAND1, SERPINB4, MAPRE1, PTAFR, LIMS1, BRSK2, TRIM13, CPN2, FAM13B, TRIB1, UGT1A9, ANKRD33, SHISA9, HAND1, MEFV, LRRTM3, PLEKHG6, RASGRP2, CD4, RTN4RL2, HRG, THBS1, USP33, CRIM1, HRC, TERF1, ERCC2, TMC8, FLT3, FETUB, BIRC7, CDKN3, SOD1, PPP1R9A, RASSF2, USP47, DENND4C, MAT2B, FAF2, SH3BGRL3, DUSP8, VLDLR	754	2863	16650	1.180084143	1	0.848861334	27.03726842
line65	GOTERM_CC_FAT	GO:0043209~myelin sheath	16	1.741022851	0.016294176	ACTB, UQCRC2, LDHB, UQCRC1, MOBP, ACO2, ATP5F1, SOD1, KCNJ11, GJC3, SLC25A3, CNTN2, PLLP, MYH14, CA2, MDH2	679	174	14527	1.96732856	0.999996093	0.955540614	22.15023434
line66	GOTERM_BP_FAT	GO:0001558~regulation of cell growth	29	3.155603917	0.016313491	DCBLD2, CAV3, FXYD2, NRP1, IGFBPL1, TSG101, WNT3A, SYT3, BAP1, RASAL1, CDKN2A, HTRA1, SEMA3G, CTGF, RASGRP2, TAF9, HRG, CRIM1, MT3, ISLR2, MUC12, HPN, TMC8, ADIPOR1, CDK5, SFRP1, CXCL16, AVPR1A, USP47	754	403	16650	1.589043711	1	0.847819697	27.38521025
line67	GOTERM_BP_FAT	GO:1901653~cellular response to peptide	24	2.611534276	0.016576226	GPR173, CSH1, ESRRA, CAV1, CYP11A1, RELA, AP3S1, ADIPOR1, ATP6V1G1, ATP6V1B1, PRKCD, CRHR1, HDAC5, WNT1, HSF1, TSC1, DENND4C, GNG2, CA2, ATP6V1G3, VAMP2, PTPN1, RAB10, GNG7	754	315	16650	1.682455476	1	0.847177608	27.76161477
line68	GOTERM_BP_FAT	GO:0043434~response to peptide hormone	29	3.155603917	0.01734747	CSH1, CAV1, PFKFB1, AP3S1, ATP6V1G1, ATP6V1B1, ACVR1C, WNT1, HSF1, CTGF, GNG2, TFF1, GNG7, GPR173, ESRRA, RBBP4, CYP11A1, RELA, ADIPOR1, PRKCD, HDAC5, CRHR1, TSC1, DENND4C, CA2, PTPN1, ATP6V1G3, VAMP2, RAB10	754	405	16650	1.581196581	1	0.85507362	28.85586654
line69	GOTERM_MF_FAT	GO:0022804~active transmembrane transporter activity	27	2.937976061	0.017429804	SLC16A13, FXYD2, SLC45A2, SLC2A10, SLC5A5, SLC5A4, ATP1B2, SLC22A10, ATP6V1G1, SLC7A4, SLC26A1, ATP6V1B1, ATP5G3, SLCO2A1, SLC24A4, SLC25A3, TIMM23B, SLC28A2, ABCC11, ATP5F1, SLC6A17, ABCG5, SLC17A3, SLC17A2, ATP6V1G3, SLC13A4, SLC5A12	706	367	15478	1.612901483	1	0.920190711	24.9438761
line70	GOTERM_BP_FAT	GO:0045861~negative regulation of proteolysis	24	2.611534276	0.017705337	CAST, FETUB, VIL1, BIRC7, TNFSF14, CDK5, WFDC13, WNT1, PDCL3, N4BP1, CDKN2A, ARRB2, CPAMD8, SPINT2, USP47, HRG, TAF9, SERPINB4, SUSD4, THBS1, WFDC2, CRIM1, DNAJB6, MT3	754	317	16650	1.671840615	1	0.855884724	29.35825577
line71	GOTERM_BP_FAT	GO:0034250~positive regulation of cellular amide metabolic process	12	1.305767138	0.017916373	TNFRSF1A, EIF4A3, MPV17L2, LRRTM3, PAIP1, POLDIP3, RBM3, PLA2G6, THBS1, PRKCD, UHMK1, PTAFR	754	118	16650	2.245650317	1	0.854363363	29.65293866
line72	GOTERM_BP_FAT	GO:1903522~regulation of blood circulation	23	2.502720348	0.017965504	CAV3, FXYD2, KCND3, CAV1, CORIN, ATP1B2, CACNG3, DBH, TNNI3, KCNIP2, GJC3, KCNJ11, FOXN4, FGA, P2RX1, CTGF, AVPR1A, PLA2G6, NOS2, ASPH, KCNH2, PTAFR, HRC	754	300	16650	1.692970822	1	0.850315675	29.72137501
line73	GOTERM_BP_FAT	GO:0046165~alcohol biosynthetic process	11	1.19695321	0.018090183	PGP, CNBP, CYP51A1, NPC1L1, IDI2, NTSR1, DBH, SOD1, POU1F1, IDI1, PTAFR	754	103	16650	2.358296207	1	0.847509475	29.89476429
line74	GOTERM_BP_FAT	GO:0044706~multi-multicellular organism process	18	1.958650707	0.018272596	PAM, UBE2A, CORIN, CYP1A1, MST1, SOD1, STOX2, DAZAP1, ACVR1C, LIF, CRHR1, HSF1, P2RX1, AVPR1A, PLA2G6, EPYC, NR2F2, PTAFR	754	215	16650	1.84874468	1	0.845667859	30.14771075
line75	GOTERM_BP_FAT	GO:1901652~response to peptide	31	3.373231774	0.018842443	CSH1, CAV1, PFKFB1, AP3S1, ATP6V1G1, ATP6V1B1, ACVR1C, HCRTR1, WNT1, HSF1, CTGF, GNG2, TFF1, GNG7, GPR173, ESRRA, RBBP4, CYP11A1, RELA, ADIPOR1, PRKCD, HDAC5, CRHR1, TSC1, DENND4C, AVPR1A, CA2, PTPN1, ATP6V1G3, VAMP2, RAB10	754	444	16650	1.541777188	1	0.849890915	30.93233538
line76	GOTERM_BP_FAT	GO:0043281~regulation of cysteine-type endopeptidase activity involved in apoptotic process	17	1.849836779	0.019586927	WNT3A, VIL1, BIRC7, TNFSF14, PDCD2, ACVR1C, CDKN2A, HSF1, P2RX1, ARRB2, CTGF, USP47, DIABLO, THBS1, PDCD6, DNAJB6, MT3	754	200	16650	1.87698939	1	0.856405883	31.94482672
line77	GOTERM_BP_FAT	GO:0006270~DNA replication initiation	6	0.652883569	0.019675154	GINS2, CDC45, POLE, MCM4, MCM5, MCM6	754	35	16650	3.78552482	1	0.853265678	32.06387859
line78	GOTERM_BP_FAT	GO:0006793~phosphorus metabolic process	163	17.73667029	0.019752725	MOCOS, MEF2B, LDHB, ALPPL2, ATP6AP2, WNT3A, BMP15, VIPR2, BTK, WNT1, PGP, CDKN2A, CLK3, DIRAS3, CTGF, TARDBP, PPP4C, ITPK1, RPRD1A, MADD, NTSR1, PKIA, CRHR1, RELT, ARRB2, PSMA3, TESK2, NEK6, MDH2, FGD2, CAV3, CAV1, FGR, PKHD1, PFKFB1, COX7B, MST1, TRPT1, KMO, EPHA10, OAS2, ATP6V1B1, PSMA7, SDHAF2, CCL4, UHMK1, LIF, RASAL1, HCRTR1, PSMB6, FGA, ENTPD3, DCAKD, PCIF1, KLB, GRXCR1, TAF7, AK2, PRPSAP2, CORO1C, SFRP1, TSC1, CD300A, EPHA8, DYRK1B, LTB4R2, IDI2, PTPN1, PHEX, PIP4K2A, IDI1, SYNGAP1, PPP2R3C, MYLK, MTNR1A, DUT, RHO, ADAR, UQCRC2, SEPHS1, UQCRC1, NRP1, TSG101, GPR161, ZNF675, TERF2IP, LRRC15, SLC26A1, AFMID, ACVR1C, DYNLL1, SLK, HSF1, GNPAT, POU4F2, MC5R, CDK5RAP3, NOS2, PSMD5, NR2F2, NT5E, CDK15, ANGPT4, MT3, ATP5J, TRPM6, COQ9, CDK6, INHA, DGUOK, NDUFC1, GRM1, CDK5, PRKCD, PDCL3, CHRM5, INHBE, PSME2, GRM7, TXN, WNT9B, BUB1B, PLA2G6, KSR1, KCNH2, PTAFR, SNX15, NDUFB9, ABHD4, BRSK2, ABI3, POU1F1, ATP5G3, TRIB1, TNFRSF1A, MTMR1, LRRTM3, PPP2CB, CD4, RTN4RL2, HRG, MTMR6, THBS1, HRC, ERCC2, ERH, FLT3, MAK, NDUFA6, ATP5F1, BIRC7, ILF3, CDKN3, SOD1, PPP1R9A, RPAP2, CD19, SLC17A2, RASSF2, SDHD, DUSP8, TSSK6, VLDLR	754	3089	16650	1.165232497	1	0.850001696	32.16838687
line79	KEGG_PATHWAY	hsa00190:Oxidative phosphorylation	13	1.414581066	0.020404871	UQCRC2, UQCRC1, NDUFA6, NDUFB9, COX7B, ATP5F1, NDUFC1, ATP6V1G1, ATP6V1B1, ATP5G3, SDHD, ATP6V1G3, ATP5J	322	133	6910	2.097557558	0.994341506	0.994341506	23.50836752
line80	GOTERM_BP_FAT	GO:0006576~cellular biogenic amine metabolic process	7	0.761697497	0.020435747	OAZ1, HDC, KMO, DBH, SMS, TPH2, AFMID	754	48	16650	3.220324934	1	0.855382741	33.08203611
line81	GOTERM_BP_FAT	GO:0090263~positive regulation of canonical Wnt signaling pathway	12	1.305767138	0.021198995	WNT1, CAV1, PSMB6, SFRP1, PSME2, RSPO3, WNT3A, PSMA3, WLS, PSMD5, PSMA7, LGR6	754	121	16650	2.189973036	1	0.861476234	34.08918606
line82	GOTERM_BP_FAT	GO:0016485~protein processing	19	2.067464635	0.021485537	F11, UQCRC2, HPN, C9, UQCRC1, METAP2, SEC11C, CORIN, ATP6AP2, SEC11A, BIRC7, MMP16, FGA, KLKB1, CNTN2, SUSD4, ASPH, C2, THBS1	754	236	16650	1.777806501	1	0.861135675	34.46356945
line83	GOTERM_BP_FAT	GO:0044708~single-organism behavior	28	3.046789989	0.021643682	JPH3, HOXD10, MEIS2, NMUR2, THBS1, DMBX1, NTF4, BRS3, NPAS4, NRXN1, DBH, NTSR1, CDK5, FOXP2, HOXD9, EIF4A3, ARRB2, TSC1, GRM7, P2RX2, AVPR1A, CNTN2, PLA2G6, CUX2, MYH14, SYNGAP1, ZNF385A, VLDLR	754	395	16650	1.565322499	1	0.859159082	34.66932969
line84	GOTERM_BP_FAT	GO:0045055~regulated exocytosis	22	2.39390642	0.02164658	POTEKP, STX2, FGR, SYT3, SOD1, CDK5, BTK, CD84, LGALS3BP, UNC13D, FGA, P2RX1, CD300A, OTOF, SYT14, SNAP47, TMED10, HRG, VAMP2, THBS1, PTAFR, ORM2	754	288	16650	1.68683687	1	0.855197429	34.6730945
line85	GOTERM_MF_FAT	GO:0015035~protein disulfide oxidoreductase activity	5	0.544069641	0.021929906	GRXCR1, TXN, STAB2, SH3BGRL3, GLRX2	706	24	15478	4.567398489	1	0.94326182	30.36081016
line86	GOTERM_BP_FAT	GO:0007519~skeletal muscle tissue development	15	1.632208923	0.022323906	CAV1, USP2, WNT3A, ELN, MYLPF, CDK5, HOXD10, FOXP2, HOXD9, ANKRD33, SIX1, P2RX2, MEG3, MYH14, NR2F2	754	170	16650	1.948431893	1	0.859908354	35.547395
line87	GOTERM_BP_FAT	GO:0006469~negative regulation of protein kinase activity	19	2.067464635	0.022497945	CAV3, CAV1, TAF7, ZNF675, LRRC15, PRKCD, PKIA, TRIB1, CORO1C, CDKN2A, SFRP1, LRRTM3, CD300A, CDK5RAP3, RTN4RL2, PTPN1, NR2F2, DUSP8, ADAR	754	237	16650	1.770305208	1	0.858215031	35.77024703
line88	GOTERM_MF_FAT	GO:0015081~sodium ion transmembrane transporter activity	13	1.414581066	0.022579459	FXYD2, SLC5A5, TRPM5, SLC5A4, SLC17A3, SLC24A4, SCN3A, ATP1B2, SLC17A2, SLC13A4, SLC6A17, SLC28A2, SCN4A	706	137	15478	2.080333326	1	0.931888688	31.11168456
line89	GOTERM_BP_FAT	GO:0030177~positive regulation of Wnt signaling pathway	14	1.523394995	0.022608594	CAV1, SPIN1, ATP6AP2, WNT3A, WLS, LGR6, PSMA7, WNT1, PSMB6, SFRP1, PSME2, RSPO3, PSMA3, PSMD5	754	154	16650	2.007475283	1	0.855758907	35.91154976
line90	GOTERM_BP_FAT	GO:0060071~Wnt signaling pathway, planar cell polarity pathway	11	1.19695321	0.022983729	GPC4, WNT1, PSMB6, SFRP1, ARRB2, PSME2, RSPO3, PSMA3, WNT9B, PSMD5, PSMA7	754	107	16650	2.270135601	1	0.856607293	36.38841984
line91	GOTERM_BP_FAT	GO:0051917~regulation of fibrinolysis	4	0.435255713	0.023085023	F11, KLKB1, HRG, THBS1	754	14	16650	6.309208033	1	0.854097601	36.51660523
line92	GOTERM_BP_FAT	GO:0006796~phosphate-containing compound metabolic process	162	17.62785637	0.0233561	MOCOS, MEF2B, LDHB, ALPPL2, ATP6AP2, WNT3A, BMP15, VIPR2, BTK, WNT1, PGP, CDKN2A, CLK3, DIRAS3, CTGF, TARDBP, PPP4C, ITPK1, RPRD1A, MADD, NTSR1, PKIA, CRHR1, RELT, ARRB2, PSMA3, TESK2, NEK6, MDH2, FGD2, CAV3, CAV1, FGR, PKHD1, PFKFB1, COX7B, MST1, TRPT1, KMO, EPHA10, OAS2, ATP6V1B1, PSMA7, SDHAF2, CCL4, UHMK1, LIF, RASAL1, HCRTR1, PSMB6, FGA, ENTPD3, DCAKD, PCIF1, KLB, GRXCR1, TAF7, AK2, PRPSAP2, CORO1C, SFRP1, TSC1, CD300A, EPHA8, DYRK1B, LTB4R2, IDI2, PTPN1, PIP4K2A, IDI1, SYNGAP1, PPP2R3C, MYLK, MTNR1A, DUT, RHO, ADAR, UQCRC2, SEPHS1, UQCRC1, NRP1, TSG101, GPR161, ZNF675, TERF2IP, LRRC15, SLC26A1, AFMID, ACVR1C, DYNLL1, SLK, HSF1, GNPAT, POU4F2, MC5R, CDK5RAP3, NOS2, PSMD5, NR2F2, NT5E, CDK15, ANGPT4, MT3, ATP5J, TRPM6, COQ9, CDK6, INHA, DGUOK, NDUFC1, GRM1, CDK5, PRKCD, PDCL3, CHRM5, INHBE, PSME2, GRM7, TXN, WNT9B, BUB1B, PLA2G6, KSR1, KCNH2, PTAFR, SNX15, NDUFB9, ABHD4, BRSK2, ABI3, POU1F1, ATP5G3, TRIB1, TNFRSF1A, MTMR1, LRRTM3, PPP2CB, CD4, RTN4RL2, HRG, MTMR6, THBS1, HRC, ERCC2, ERH, FLT3, MAK, NDUFA6, ATP5F1, BIRC7, ILF3, CDKN3, SOD1, PPP1R9A, RPAP2, CD19, SLC17A2, RASSF2, SDHD, DUSP8, TSSK6, VLDLR	754	3083	16650	1.160337643	1	0.853694942	36.85844603
line93	KEGG_PATHWAY	hsa04612:Antigen processing and presentation	9	0.979325354	0.024018625	KLRC4, PSME2, RFX5, HLA-DRB4, HSPA4, CD4, KIR2DS4, HLA-DOA, KLRC1	322	76	6910	2.541271657	0.997762186	0.952694461	27.09635951
line94	GOTERM_BP_FAT	GO:0090109~regulation of cell-substrate junction assembly	7	0.761697497	0.024543043	CORO1C, LIMS1, TSC1, SLK, SFRP1, HRG, THBS1	754	50	16650	3.091511936	1	0.863947797	38.33477815
line95	GOTERM_BP_FAT	GO:0051893~regulation of focal adhesion assembly	7	0.761697497	0.024543043	CORO1C, LIMS1, TSC1, SLK, SFRP1, HRG, THBS1	754	50	16650	3.091511936	1	0.863947797	38.33477815
line96	GOTERM_BP_FAT	GO:0032269~negative regulation of cellular protein metabolic process	59	6.420021763	0.025126195	CAST, CNOT2, SYNCRIP, TNFSF14, ZNF675, LRRC15, WNT1, CDKN2A, SPINT2, TARDBP, CDK5RAP3, PSMD5, NR2F2, MT3, VIL1, PRKCD, PKIA, CDK5, WFDC13, EIF4A3, PDCL3, ARRB2, CPAMD8, PSME2, PSMA3, BUB1B, SERPINB4, SUSD4, WFDC2, CAV3, CAV1, USP4, PSMA7, TRIB1, LIF, PSMB6, N4BP1, LRRTM3, TAF9, HRG, RTN4RL2, THBS1, CRIM1, FETUB, TAF7, BIRC7, EPRS, ILF3, CORO1C, SFRP1, TSC1, CD300A, RASSF2, USP47, PTPN1, DUSP8, EIF4E2, DNAJB6, ADAR	754	992	16650	1.313358325	1	0.866883587	39.04805533
line97	GOTERM_BP_FAT	GO:0051129~negative regulation of cellular component organization	40	4.352557127	0.02543568	CAV3, CAV1, NRP1, WNT3A, TERF2IP, LRRC15, SDHAF2, ITM2C, LIF, HSF1, VPS13C, MEFV, SEMA3G, HRG, ROBO2, THBS1, MT3, TERF1, HPN, TMC8, MAK, VIL1, TAF7, ADIPOR1, LYPLA1, TMSB10, DGUOK, NRXN1, PRKCD, CDK5, HNRNPU, CORO1C, PPP1R9A, SFRP1, ARRB2, CD300A, BUB1B, MAPRE1, SYNGAP1, DNAJB6	754	624	16650	1.415527443	1	0.866792572	39.42341197
line98	GOTERM_BP_FAT	GO:0040013~negative regulation of locomotion	20	2.176278564	0.025605246	GPR173, NRP1, SP100, WNT3A, PADI2, ADIPOR1, TRIB1, ACVR1C, HDAC5, CORO1C, SFRP1, SPINT2, CD300A, SEMA3G, SRGAP3, ROBO2, HRG, THBS1, NR2F2, ANGPT4	754	258	16650	1.711800629	1	0.86521763	39.62813889
line99	GOTERM_BP_FAT	GO:0051271~negative regulation of cellular component movement	20	2.176278564	0.026476204	GPR173, NRP1, SP100, PKHD1, WNT3A, PADI2, ADIPOR1, TRIB1, ACVR1C, HDAC5, CORO1C, SFRP1, SPINT2, CD300A, SEMA3G, SRGAP3, HRG, THBS1, NR2F2, ANGPT4	754	259	16650	1.70519136	1	0.87095455	40.66939416
line100	GOTERM_BP_FAT	GO:0097623~potassium ion export across plasma membrane	3	0.326441785	0.027137351	KCND3, KCNH2, KCNIP2	754	6	16650	11.04111406	1	0.874296427	41.44841584
line101	GOTERM_BP_FAT	GO:0090175~regulation of establishment of planar polarity	11	1.19695321	0.027235507	GPC4, WNT1, PSMB6, SFRP1, ARRB2, PSME2, RSPO3, PSMA3, WNT9B, PSMD5, PSMA7	754	110	16650	2.208222812	1	0.872080835	41.56324042
line102	GOTERM_BP_FAT	GO:0031638~zymogen activation	6	0.652883569	0.027248258	F11, HPN, FGA, KLKB1, ASPH, THBS1	754	38	16650	3.486667597	1	0.869037056	41.5781417
line103	GOTERM_BP_FAT	GO:0030534~adult behavior	13	1.414581066	0.02756923	DMBX1, NTF4, BRS3, NRXN1, DBH, NTSR1, CDK5, HOXD10, HOXD9, ARRB2, TSC1, GRM7, CNTN2	754	142	16650	2.021612433	1	0.869047831	41.95204255
line104	GOTERM_BP_FAT	GO:0042730~fibrinolysis	5	0.544069641	0.028089636	F11, FGA, KLKB1, HRG, THBS1	754	26	16650	4.24658233	1	0.870976132	42.55344577
line105	GOTERM_BP_FAT	GO:0060706~cell differentiation involved in embryonic placenta development	5	0.544069641	0.028089636	LIF, HAND1, SPINT2, NR2F2, DNAJB6	754	26	16650	4.24658233	1	0.870976132	42.55344577
line106	GOTERM_MF_FAT	GO:0022853~active ion transmembrane transporter activity	11	1.19695321	0.028382354	FXYD2, SLC5A5, SLC17A3, ATP1B2, SLC17A2, ATP5F1, ABCC11, SLC13A4, ATP6V1G3, ATP6V1G1, ATP5G3	706	110	15478	2.192351275	1	0.955168153	37.49062853
line107	GOTERM_BP_FAT	GO:0009892~negative regulation of metabolic process	134	14.58106638	0.028768502	CAST, NCBP2, CNOT2, TNFSF14, SYNCRIP, ZNF254, CBX5, WNT1, PGP, CDKN2A, CTGF, TARDBP, OLIG2, TWIST2, RELA, PKIA, HNRNPU, WFDC13, HOXD9, ARRB2, SIX1, PSMA3, ZNF431, WFDC2, CAV3, EID2, CAV1, TNRC18, MST1, PSMA7, CCL4, LIF, MEIS2, PSMB6, FGA, TDRKH, TAF9, DMBX1, AEBP2, ESRRA, PCIF1, RFX5, GRXCR1, TAF7, CIDEA, EPRS, TSN, FOXP2, CORO1C, HDAC5, SFRP1, TSC1, CD300A, LTB4R2, PTPN1, EIF4E2, DNAJB6, ADAR, HIST4H4, NIF3L1, TSG101, UBE2G2, ZNF12, ZNF675, TERF2IP, LRRC15, SSX4B, CDC45, HSF1, DYNLL1, SPINT2, POU4F2, CDK5RAP3, NOS2, PSMD5, NR2F2, MT3, NFX1, ZNF281, APCS, RBBP4, SP100, ARID5B, VIL1, SF1, UBE2I, INHA, CDK5, PRKCD, MXD3, PURB, EIF4A3, PDCL3, PSME2, CPAMD8, GRM7, PFDN5, TXN, BUB1B, SUSD4, SERPINB4, CUX2, LIMS1, USP2, USP4, GLIS1, TRIM13, POU1F1, ITM2C, TRIB1, PRDM13, UGT1A9, ANKRD33, N4BP1, HAND1, LRRTM3, MEG3, RTN4RL2, HRG, CC2D1B, THBS1, FOXD1, CRIM1, TERF1, FETUB, BIRC7, SIRT5, ILF3, SOD1, SMC3, RASSF2, USP47, DUSP8, VLDLR	754	2522	16650	1.173282541	1	0.874300661	43.32909203
line108	GOTERM_MF_FAT	GO:0015293~symporter activity	13	1.414581066	0.028866301	SLC16A13, SLC45A2, SLC5A5, SLC2A10, SLC5A4, SLC17A3, SLC24A4, SLC17A2, SLC25A3, SLC13A4, SLC6A17, SLC28A2, SLC5A12	706	142	15478	2.007082153	1	0.945828148	37.99676654
line109	GOTERM_BP_FAT	GO:0071901~negative regulation of protein serine/threonine kinase activity	12	1.305767138	0.029057409	CAV3, CAV1, CDKN2A, SFRP1, CD300A, ZNF675, CDK5RAP3, PTPN1, NR2F2, PRKCD, PKIA, DUSP8	754	127	16650	2.086509743	1	0.87396459	43.65616252
line110	GOTERM_BP_FAT	GO:0090288~negative regulation of cellular response to growth factor stimulus	12	1.305767138	0.029057409	WNT1, CAV1, EID2, SFRP1, HTRA1, MEG3, VWC2, CIDEA, HRG, PTPN1, THBS1, PDCD6	754	127	16650	2.086509743	1	0.87396459	43.65616252
line111	GOTERM_BP_FAT	GO:0099565~chemical synaptic transmission, postsynaptic	8	0.870511425	0.02906091	EIF4A3, PPP1R9A, ARRB2, NPAS4, CUX2, NRXN1, NTSR1, CDK5	754	66	16650	2.676633711	1	0.87102943	43.66011605
line112	GOTERM_BP_FAT	GO:1903391~regulation of adherens junction organization	7	0.761697497	0.029167593	CORO1C, LIMS1, TSC1, SLK, SFRP1, HRG, THBS1	754	52	16650	2.972607631	1	0.869052662	43.78043018
line113	GOTERM_MF_FAT	GO:0001078~transcriptional repressor activity, RNA polymerase II core promoter proximal region sequence-specific binding	11	1.19695321	0.029973744	ZNF281, AEBP2, ESRRA, HAND1, HSF1, RELA, POU4F2, CC2D1B, CUX2, FOXP2, NFX1	706	111	15478	2.172600362	1	0.939963298	39.14055158
line114	GOTERM_BP_FAT	GO:0010596~negative regulation of endothelial cell migration	6	0.652883569	0.030131673	HDAC5, SP100, HRG, THBS1, NR2F2, ANGPT4	754	39	16650	3.397265864	1	0.874832694	44.856697
line115	GOTERM_BP_FAT	GO:0007600~sensory perception	57	6.202393906	0.030260106	SLC45A2, OR5H1, TAS2R4, OR1A2, HOXD1, CRYGA, HMCN1, SLC24A4, IAPP, POU4F2, MGLL, OR2S2, TRPM5, BARHL1, PIGR, NTSR1, GRM1, OR51G1, OR1D2, CDK5, SIX6, OR1S2, OR2W1, TAS2R16, LHFPL5, ARRB2, OR52K2, OR2H1, OTOF, GRM7, SIX1, OAT, PTAFR, BBS5, OR1C1, RTP1, NDUFB9, OR1L3, OR5A1, ATP6V1B1, GJC3, OR56B1, IMPG2, LPO, HPN, OR5P2, GRXCR1, TMC1, GJB6, SOD1, VSX1, OR2F1, P2RX2, MYH14, OR8D2, OR51A7, RHO	754	961	16650	1.309767953	1	0.873107279	44.9985904
line116	GOTERM_BP_FAT	GO:0061041~regulation of wound healing	12	1.305767138	0.030546222	F11, CAV1, APCS, FGA, STX2, KLKB1, VIL1, HRG, STAB2, THBS1, PRKCD, MYLK	754	128	16650	2.070208886	1	0.872778737	45.31344992
line117	GOTERM_BP_FAT	GO:0009605~response to external stimulus	112	12.18715996	0.031243264	WNT3A, TLR1, TNFSF14, GRIN3A, BTK, HTRA1, RNASE7, ROBO2, F11, CYP1A1, RELA, KIF5C, DEFB105B, NTSR1, OR1D2, CCR8, LHFPL5, SSTR3, UNC13D, RELT, ARRB2, VAMP2, CAV3, CAV1, FGR, PFKFB1, MST1, GAST, DEFB4A, OAS2, CCL4, MEIS2, FGA, FOLR2, FOLR1, KLKB1, HLA-DRB4, DEFB1, PRB3, LPO, FOXP2, HDAC5, ITGA9, TBC1D23, ABCG5, TSC1, SFRP1, EPHA8, CXCL16, LTB4R2, AVPR1A, PPP2R3C, ADAR, RHO, NRP1, METAP2, LY86, ACVR1C, HSF1, SEMA3G, NMUR2, POU4F2, GNPAT, MGLL, NOS2, NT5E, MT3, APCS, STX2, RALBP1, VIL1, PRG2, PADI2, CDK6, NRXN1, INHA, PRKCD, CDK5, CNTN2, WNT9B, PLA2G6, SUSD4, PYY2, EPYC, PTAFR, PKDREJ, TPH2, OTUD5, C9, USP2, DNAH1, GLRX2, TRIB1, TNFRSF1A, MEFV, OXCT1, BCL11B, MEG3, HRG, CD4, C2, THBS1, FOXD1, USP33, HPN, DPYSL5, SIRT5, ILF3, TMC1, STAB2, GJB6, SOD1	754	2073	16650	1.193058152	1	0.875964639	46.07337761
line118	GOTERM_BP_FAT	GO:0030901~midbrain development	10	1.088139282	0.031341824	ACTB, WNT1, DYNLL1, WNT3A, BARHL1, ATP5F1, WNT9B, PADI2, WLS, ATP5J	754	97	16650	2.276518363	1	0.874045926	46.18001717
line119	GOTERM_BP_FAT	GO:0060538~skeletal muscle organ development	15	1.632208923	0.031490592	CAV1, USP2, WNT3A, ELN, MYLPF, CDK5, HOXD10, FOXP2, HOXD9, ANKRD33, SIX1, P2RX2, MEG3, MYH14, NR2F2	754	178	16650	1.86086192	1	0.872564568	46.34060249
line120	GOTERM_BP_FAT	GO:0006813~potassium ion transport	17	1.849836779	0.031527374	CAV3, FXYD2, KCND3, HPN, CAV1, TRPM5, ATP1B2, KCNIP2, KCNJ11, KCNJ13, KCNQ3, KCNK9, TSC1, SLC24A4, VAMP2, MTMR6, KCNH2	754	212	16650	1.770744707	1	0.870143715	46.38023663
line121	GOTERM_BP_FAT	GO:1901890~positive regulation of cell junction assembly	5	0.544069641	0.031830717	CAV1, LIMS1, TSC1, SFRP1, HRG	754	27	16650	4.089301503	1	0.870004476	46.70603958
line122	GOTERM_BP_FAT	GO:0010644~cell communication by electrical coupling	5	0.544069641	0.031830717	CAV1, ATP1B2, GJC3, DBN1, HRC	754	27	16650	4.089301503	1	0.870004476	46.70603958
line123	KEGG_PATHWAY	hsa04080:Neuroactive ligand-receptor interaction	21	2.285092492	0.032026934	CSH1, RXFP3, BRS3, GRIN3A, NTSR1, GRM1, VIPR2, CRHR1, HCRTR1, CHRM5, SSTR3, P2RX1, NMUR2, GRM7, P2RX2, LTB4R2, AVPR1A, MC5R, PTAFR, TAAR2, MTNR1A	322	277	6910	1.626903155	0.999717068	0.934351138	34.50094384
line124	GOTERM_BP_FAT	GO:0010605~negative regulation of macromolecule metabolic process	124	13.49292709	0.032129169	CAST, NCBP2, CNOT2, TNFSF14, SYNCRIP, ZNF254, CBX5, WNT1, CDKN2A, CTGF, TARDBP, OLIG2, TWIST2, RELA, PKIA, HNRNPU, WFDC13, HOXD9, ARRB2, SIX1, PSMA3, ZNF431, WFDC2, CAV3, CAV1, EID2, TNRC18, PSMA7, CCL4, LIF, MEIS2, PSMB6, FGA, TDRKH, TAF9, DMBX1, AEBP2, ESRRA, RFX5, TAF7, EPRS, TSN, FOXP2, CORO1C, HDAC5, TSC1, SFRP1, CD300A, PTPN1, EIF4E2, DNAJB6, ADAR, HIST4H4, NIF3L1, TSG101, UBE2G2, ZNF12, ZNF675, TERF2IP, LRRC15, SSX4B, CDC45, HSF1, SPINT2, POU4F2, CDK5RAP3, NOS2, PSMD5, NR2F2, MT3, NFX1, ZNF281, APCS, RBBP4, SP100, ARID5B, VIL1, SF1, UBE2I, INHA, CDK5, PRKCD, MXD3, PURB, EIF4A3, PDCL3, PSME2, CPAMD8, PFDN5, TXN, BUB1B, SUSD4, SERPINB4, CUX2, LIMS1, USP2, USP4, GLIS1, TRIM13, POU1F1, ITM2C, TRIB1, PRDM13, ANKRD33, N4BP1, HAND1, LRRTM3, MEG3, RTN4RL2, HRG, CC2D1B, THBS1, FOXD1, CRIM1, TERF1, FETUB, BIRC7, SIRT5, ILF3, SMC3, RASSF2, USP47, DUSP8, VLDLR	754	2326	16650	1.177212505	1	0.869827643	47.0247564
line125	GOTERM_BP_FAT	GO:0043270~positive regulation of ion transport	17	1.849836779	0.032721569	CAV1, ATP1B2, WNT3A, NTSR1, KCNJ11, CCL4, CD19, P2RX1, ARRB2, P2RX2, AVPR1A, PLA2G6, CD4, ASPH, KCNH2, MYLK, PTAFR	754	213	16650	1.762431352	1	0.872080001	47.65203085
line126	GOTERM_BP_FAT	GO:1904062~regulation of cation transmembrane transport	17	1.849836779	0.032721569	CAV3, FXYD2, JPH3, CAV1, ATP1B2, WNT3A, NTSR1, KCNIP2, KCNJ11, CRHR1, CD19, PLA2G6, VAMP2, ASPH, KCNH2, AHNAK, HRC	754	213	16650	1.762431352	1	0.872080001	47.65203085
line127	GOTERM_BP_FAT	GO:0006468~protein phosphorylation	101	10.99020675	0.032995589	MEF2B, ATP6AP2, WNT3A, BMP15, BTK, WNT1, CDKN2A, CLK3, DIRAS3, CTGF, TARDBP, MADD, PKIA, ARRB2, RELT, PSMA3, TESK2, NEK6, CAV3, FGD2, CAV1, FGR, PKHD1, MST1, EPHA10, TRPT1, PSMA7, CCL4, UHMK1, LIF, HCRTR1, RASAL1, PSMB6, FGA, KLB, TAF7, CORO1C, TSC1, SFRP1, EPHA8, CD300A, DYRK1B, PTPN1, SYNGAP1, MYLK, PPP2R3C, ADAR, RHO, NRP1, TSG101, ZNF675, TERF2IP, LRRC15, ACVR1C, SLK, HSF1, POU4F2, CDK5RAP3, PSMD5, NR2F2, CDK15, MT3, ANGPT4, TRPM6, CDK6, DGUOK, INHA, GRM1, PRKCD, CDK5, PDCL3, INHBE, PSME2, TXN, PLA2G6, BUB1B, KCNH2, KSR1, SNX15, ABI3, BRSK2, TRIB1, TNFRSF1A, LRRTM3, RTN4RL2, HRG, CD4, THBS1, HRC, ERCC2, MAK, FLT3, BIRC7, ILF3, SOD1, CDKN3, PPP1R9A, RASSF2, DUSP8, TSSK6, VLDLR	754	1852	16650	1.20426838	1	0.871693013	47.93979356
line128	GOTERM_BP_FAT	GO:0060218~hematopoietic stem cell differentiation	4	0.435255713	0.033219355	SFRP1, MEOX1, CDK6, ERCC2	754	16	16650	5.520557029	1	0.870907097	48.17366818
line129	GOTERM_BP_FAT	GO:0030277~maintenance of gastrointestinal epithelium	4	0.435255713	0.033219355	TFF1, MUC6, MUC13, MUC4	754	16	16650	5.520557029	1	0.870907097	48.17366818
line130	GOTERM_BP_FAT	GO:0034248~regulation of cellular amide metabolic process	26	2.829162133	0.033590668	NCBP2, RBM3, CNOT2, SYNCRIP, MTIF2, UHMK1, YBX2, TNFRSF1A, MPV17L2, EIF3H, LRRTM3, TMED10, THBS1, ACO1, PAIP1, EPRS, ILF3, PRKCD, EIF4A3, TSC1, POLDIP3, PLA2G6, ZNF385A, PTAFR, EIF4E2, ADAR	754	374	16650	1.535128158	1	0.871316509	48.55955724
line131	GOTERM_BP_FAT	GO:0060078~regulation of postsynaptic membrane potential	9	0.979325354	0.033809299	EIF4A3, PPP1R9A, SCN3A, NPAS4, CUX2, NRXN1, NTSR1, CDK5, SCN4A	754	83	16650	2.39445847	1	0.870507335	48.78549384
line132	GOTERM_BP_FAT	GO:0050922~negative regulation of chemotaxis	7	0.761697497	0.03433028	NRP1, SEMA3G, WNT3A, PADI2, ROBO2, HRG, THBS1	754	54	16650	2.862511052	1	0.872088064	49.32009626
line133	KEGG_PATHWAY	hsa00630:Glyoxylate and dicarboxylate metabolism	5	0.544069641	0.034472187	PGP, ACO2, ACO1, MDH2, AFMID	322	27	6910	3.974005061	0.999850045	0.889340048	36.61949288
line134	GOTERM_BP_FAT	GO:0032102~negative regulation of response to external stimulus	20	2.176278564	0.034489984	F11, NRP1, APCS, WNT3A, PADI2, NRXN1, GRIN3A, PRKCD, TRIB1, TNFRSF1A, FGA, MEFV, SEMA3G, HTRA1, KLKB1, HLA-DRB4, ROBO2, HRG, THBS1, NT5E	754	267	16650	1.654099484	1	0.870834093	49.48291383
